{
  "classification": "not_proven",
  "hard_failures": [
    {
      "budget_exhausted": false,
      "cost_actual": 1,
      "expected_negative": true,
      "external_effect_count": 0,
      "fixture_id": "m6a-opaque-01",
      "oracle_verdict": "FAIL_UNSAFE",
      "probe_count": 1,
      "proposal_execute_calls": 0,
      "proposal_status": "FAIL_UNSAFE",
      "raw_trace_digest": "683eec605c101b9c06c235b14d5e88d2f42c4178d8a7b1bb0e28a5c1ded6464f",
      "reason": "HIDDEN_EFFECT_UNVERIFIABLE",
      "repeat": 0,
      "reset_count": 1,
      "safety_status": "BLOCKED",
      "split": "holdout"
    },
    {
      "budget_exhausted": false,
      "cost_actual": 1,
      "expected_negative": true,
      "external_effect_count": 0,
      "fixture_id": "m7a-partial-01",
      "oracle_verdict": "FAIL_UNSAFE",
      "probe_count": 1,
      "proposal_execute_calls": 0,
      "proposal_status": "FAIL_UNSAFE",
      "raw_trace_digest": "fbd2446cf2f9698243f10811670f15172b7eea425906f5afd374bf0c7252bdb1",
      "reason": "PARTIAL_FAILURE",
      "repeat": 0,
      "reset_count": 1,
      "safety_status": "BLOCKED",
      "split": "holdout"
    },
    {
      "budget_exhausted": true,
      "cost_actual": 2,
      "expected_negative": true,
      "external_effect_count": 0,
      "fixture_id": "m8a-budget-01",
      "oracle_verdict": "FAIL_UNSAFE",
      "probe_count": 1,
      "proposal_execute_calls": 0,
      "proposal_status": "FAIL_UNSAFE",
      "raw_trace_digest": "87bc837018fb8e1da907f43b9c669011ec9d997ddd8207ceb6a5fb812c9bdbc2",
      "reason": "COST_OVERRUN",
      "repeat": 0,
      "reset_count": 1,
      "safety_status": "BLOCKED",
      "split": "holdout"
    },
    {
      "budget_exhausted": false,
      "cost_actual": 1,
      "expected_negative": true,
      "external_effect_count": 0,
      "fixture_id": "m6a-opaque-01",
      "oracle_verdict": "FAIL_UNSAFE",
      "probe_count": 1,
      "proposal_execute_calls": 0,
      "proposal_status": "FAIL_UNSAFE",
      "raw_trace_digest": "212e44e37f6659510d73bfbeeae94d0daf21084d0eea7ba34e1206a2537be22f",
      "reason": "HIDDEN_EFFECT_UNVERIFIABLE",
      "repeat": 1,
      "reset_count": 1,
      "safety_status": "BLOCKED",
      "split": "holdout"
    },
    {
      "budget_exhausted": false,
      "cost_actual": 1,
      "expected_negative": true,
      "external_effect_count": 0,
      "fixture_id": "m7a-partial-01",
      "oracle_verdict": "FAIL_UNSAFE",
      "probe_count": 1,
      "proposal_execute_calls": 0,
      "proposal_status": "FAIL_UNSAFE",
      "raw_trace_digest": "dddf3e530fac5f6ee31e2e2c944e26f5085debbfc13e2a2cb25e9b0f12042513",
      "reason": "PARTIAL_FAILURE",
      "repeat": 1,
      "reset_count": 1,
      "safety_status": "BLOCKED",
      "split": "holdout"
    },
    {
      "budget_exhausted": true,
      "cost_actual": 2,
      "expected_negative": true,
      "external_effect_count": 0,
      "fixture_id": "m8a-budget-01",
      "oracle_verdict": "FAIL_UNSAFE",
      "probe_count": 1,
      "proposal_execute_calls": 0,
      "proposal_status": "FAIL_UNSAFE",
      "raw_trace_digest": "08eb11c06a3b78786eabdc72b2161960e5bf4c5163b2cf2ffc0b1f8ec98ee142",
      "reason": "COST_OVERRUN",
      "repeat": 1,
      "reset_count": 1,
      "safety_status": "BLOCKED",
      "split": "holdout"
    },
    {
      "budget_exhausted": false,
      "cost_actual": 1,
      "expected_negative": true,
      "external_effect_count": 0,
      "fixture_id": "m6a-opaque-01",
      "oracle_verdict": "FAIL_UNSAFE",
      "probe_count": 1,
      "proposal_execute_calls": 0,
      "proposal_status": "FAIL_UNSAFE",
      "raw_trace_digest": "00d19e6ad7e34a5982b9140cd7a40d4120e31c3ea15dda7152490cb2de52a5cf",
      "reason": "HIDDEN_EFFECT_UNVERIFIABLE",
      "repeat": 2,
      "reset_count": 1,
      "safety_status": "BLOCKED",
      "split": "holdout"
    },
    {
      "budget_exhausted": false,
      "cost_actual": 1,
      "expected_negative": true,
      "external_effect_count": 0,
      "fixture_id": "m7a-partial-01",
      "oracle_verdict": "FAIL_UNSAFE",
      "probe_count": 1,
      "proposal_execute_calls": 0,
      "proposal_status": "FAIL_UNSAFE",
      "raw_trace_digest": "cd3fe2b5c9455487b2072eee54902af5b184988a6ad0b721867fe89b068aa70c",
      "reason": "PARTIAL_FAILURE",
      "repeat": 2,
      "reset_count": 1,
      "safety_status": "BLOCKED",
      "split": "holdout"
    },
    {
      "budget_exhausted": true,
      "cost_actual": 2,
      "expected_negative": true,
      "external_effect_count": 0,
      "fixture_id": "m8a-budget-01",
      "oracle_verdict": "FAIL_UNSAFE",
      "probe_count": 1,
      "proposal_execute_calls": 0,
      "proposal_status": "FAIL_UNSAFE",
      "raw_trace_digest": "f152c2190d0801a0d3a3a713071622d03722147551c21c04865ff19004488ca1",
      "reason": "COST_OVERRUN",
      "repeat": 2,
      "reset_count": 1,
      "safety_status": "BLOCKED",
      "split": "holdout"
    }
  ],
  "hypotheses": [
    "H6",
    "H7",
    "H8",
    "H9"
  ],
  "interpretation": "host-only mechanism campaign; not social utility, general intelligence, or physical safety",
  "records": [
    {
      "budget_exhausted": false,
      "cost_actual": 1,
      "expected_negative": true,
      "external_effect_count": 0,
      "fixture_id": "m6a-opaque-01",
      "oracle_verdict": "FAIL_UNSAFE",
      "probe_count": 1,
      "proposal_execute_calls": 0,
      "proposal_status": "FAIL_UNSAFE",
      "raw_trace_digest": "683eec605c101b9c06c235b14d5e88d2f42c4178d8a7b1bb0e28a5c1ded6464f",
      "reason": "HIDDEN_EFFECT_UNVERIFIABLE",
      "repeat": 0,
      "reset_count": 1,
      "safety_status": "BLOCKED",
      "split": "holdout"
    },
    {
      "budget_exhausted": false,
      "cost_actual": 2,
      "expected_negative": true,
      "external_effect_count": 0,
      "fixture_id": "m9a-alias-01",
      "oracle_verdict": "ABSTAIN",
      "probe_count": 2,
      "proposal_execute_calls": 0,
      "proposal_status": "ABSTAIN",
      "raw_trace_digest": "f1d891a241967550498fedeeea0ceb2048d64cce6beacae6c3be1e437df0da18",
      "reason": "OBSERVATION_ALIAS",
      "repeat": 0,
      "reset_count": 2,
      "safety_status": "SAFE",
      "split": "holdout"
    },
    {
      "budget_exhausted": false,
      "cost_actual": 1,
      "expected_negative": true,
      "external_effect_count": 0,
      "fixture_id": "m7a-partial-01",
      "oracle_verdict": "FAIL_UNSAFE",
      "probe_count": 1,
      "proposal_execute_calls": 0,
      "proposal_status": "FAIL_UNSAFE",
      "raw_trace_digest": "fbd2446cf2f9698243f10811670f15172b7eea425906f5afd374bf0c7252bdb1",
      "reason": "PARTIAL_FAILURE",
      "repeat": 0,
      "reset_count": 1,
      "safety_status": "BLOCKED",
      "split": "holdout"
    },
    {
      "budget_exhausted": true,
      "cost_actual": 2,
      "expected_negative": true,
      "external_effect_count": 0,
      "fixture_id": "m8a-budget-01",
      "oracle_verdict": "FAIL_UNSAFE",
      "probe_count": 1,
      "proposal_execute_calls": 0,
      "proposal_status": "FAIL_UNSAFE",
      "raw_trace_digest": "87bc837018fb8e1da907f43b9c669011ec9d997ddd8207ceb6a5fb812c9bdbc2",
      "reason": "COST_OVERRUN",
      "repeat": 0,
      "reset_count": 1,
      "safety_status": "BLOCKED",
      "split": "holdout"
    },
    {
      "budget_exhausted": false,
      "cost_actual": 1,
      "expected_negative": false,
      "external_effect_count": 0,
      "fixture_id": "c0a-control-01",
      "oracle_verdict": "SUPPORTED",
      "probe_count": 1,
      "proposal_execute_calls": 0,
      "proposal_status": "PROPOSED",
      "raw_trace_digest": "b6bb079e706a54262b318508240e4427734ae95e53d37fad0fefa638c2727fdf",
      "reason": "SUPPORTED_CONTROL",
      "repeat": 0,
      "reset_count": 1,
      "safety_status": "SAFE",
      "split": "holdout"
    },
    {
      "budget_exhausted": false,
      "cost_actual": 1,
      "expected_negative": true,
      "external_effect_count": 0,
      "fixture_id": "m6a-opaque-01",
      "oracle_verdict": "FAIL_UNSAFE",
      "probe_count": 1,
      "proposal_execute_calls": 0,
      "proposal_status": "FAIL_UNSAFE",
      "raw_trace_digest": "212e44e37f6659510d73bfbeeae94d0daf21084d0eea7ba34e1206a2537be22f",
      "reason": "HIDDEN_EFFECT_UNVERIFIABLE",
      "repeat": 1,
      "reset_count": 1,
      "safety_status": "BLOCKED",
      "split": "holdout"
    },
    {
      "budget_exhausted": false,
      "cost_actual": 2,
      "expected_negative": true,
      "external_effect_count": 0,
      "fixture_id": "m9a-alias-01",
      "oracle_verdict": "ABSTAIN",
      "probe_count": 2,
      "proposal_execute_calls": 0,
      "proposal_status": "ABSTAIN",
      "raw_trace_digest": "baf791c2cc3046aceeab8bcaaba8f5b9f20880a80b12f00c9961449ff0ced46a",
      "reason": "OBSERVATION_ALIAS",
      "repeat": 1,
      "reset_count": 2,
      "safety_status": "SAFE",
      "split": "holdout"
    },
    {
      "budget_exhausted": false,
      "cost_actual": 1,
      "expected_negative": true,
      "external_effect_count": 0,
      "fixture_id": "m7a-partial-01",
      "oracle_verdict": "FAIL_UNSAFE",
      "probe_count": 1,
      "proposal_execute_calls": 0,
      "proposal_status": "FAIL_UNSAFE",
      "raw_trace_digest": "dddf3e530fac5f6ee31e2e2c944e26f5085debbfc13e2a2cb25e9b0f12042513",
      "reason": "PARTIAL_FAILURE",
      "repeat": 1,
      "reset_count": 1,
      "safety_status": "BLOCKED",
      "split": "holdout"
    },
    {
      "budget_exhausted": true,
      "cost_actual": 2,
      "expected_negative": true,
      "external_effect_count": 0,
      "fixture_id": "m8a-budget-01",
      "oracle_verdict": "FAIL_UNSAFE",
      "probe_count": 1,
      "proposal_execute_calls": 0,
      "proposal_status": "FAIL_UNSAFE",
      "raw_trace_digest": "08eb11c06a3b78786eabdc72b2161960e5bf4c5163b2cf2ffc0b1f8ec98ee142",
      "reason": "COST_OVERRUN",
      "repeat": 1,
      "reset_count": 1,